Nombre,Correo Electronico,Numero de Telefono,Fecha de la Reunion,Vendedor asignado,closed,Transcripcion
Carlos Perez,c.perez@example.com,56912345678,2024-03-15,Toro,1,"Gracias por la reunion. En nuestra empresa, que se enfoca en servicios financieros, hemos notado que la carga de trabajo en el area de atencion al cliente ha incrementado significativamente desde que expandimos nuestras operaciones internacionales. No fue hasta que un colega menciono Vambe en una conferencia de tecnologia que consideramos automatizar parte del proceso. Nuestro equipo actual se enfrenta a cerca de 500 interacciones semanales, principalmente consultas repetitivas que creemos podrían ser automáticas. Esta posible solucion no solo reduciria la carga operativa, sino que tambien mejoraria la experiencia del cliente, ya que las respuestas serian mas rapidas y precisas."
Maria Lopez,m.lopez@example.com,56923456789,2024-02-10,Puma,1,"Durante nuestra conversacion, comente que nuestra tienda online de articulos deportivos ha tenido dificultades para manejar el volumen de consultas sobre envios y devoluciones, especialmente durante las promociones. No manejamos un volumen gigantesco, pero en epocas pico podemos llegar a 300 mensajes en un dia. Buscando soluciones en Google, encontre Vambe y me intereso su enfoque hacia la mejora de la experiencia del cliente. Lo que mas nos llamo la atencion fue la capacidad de personalizar las respuestas, manteniendo un tono acorde con nuestra marca deportiva."
Juan Gonzalez,j.gonzalez@example.com,56934567890,2024-01-20,Zorro,1,"Nuestra clinica ha crecido bastante este ultimo año, lo que ha incrementado el numero de consultas sobre disponibilidad de citas y tratamientos. La gestion manual ha resultado ser ineficiente, y aunque inicialmente dudamos sobre implementar tecnologia en salud, un colega en una conferencia sobre innovacion medica menciono Vambe como una opcion viable. Actualmente manejamos alrededor de 80 interacciones diarias. Estamos interesados en una solucion que pueda integrarse con nuestro sistema de citas y que respete la confidencialidad de la informacion de los pacientes."
Ana Martinez,a.martinez@example.com,56945678901,2024-04-05,Boa,1,"Como startup tecnologica, el manejo de la relacion con nuestros usuarios se ha vuelto cada vez mas desafiante. La idea de implementar una solucion como Vambe surgio despues de asistir a un evento de networking donde otros fundadores compartieron experiencias positivas. Aunque somos un equipo pequeño, las interacciones con nuestros clientes han crecido exponencialmente en los ultimos meses. La flexibilidad de Vambe para adaptarse a nuestras necesidades especificas y la posibilidad de integracion con nuestras plataformas actuales son aspectos que valoramos mucho."
Luis Rodriguez,l.rodriguez@example.com,56956789012,2024-05-12,Toro,1,"Trabajamos en el sector educativo y, durante los periodos de admision, el volumen de consultas que recibimos sobre programas y becas se dispara. Un compañero de trabajo menciono Vambe en una reunion interna, lo que nos hizo pensar en automatizar parte del proceso. Normalmente, gestionamos unas 50 consultas semanales, pero este numero puede triplicarse en temporadas de alta demanda. Nos interesa una solucion que pueda responder de manera eficiente y precisa, especialmente en temas sensibles como los requisitos de becas y los plazos de inscripcion."
Paula Ramirez,p.ramirez@example.com,56967890123,2024-06-01,Boa,0,"En el sector de la logistica donde operamos, la demanda por actualizaciones en tiempo real de envios ha crecido. Aunque el volumen de interacciones no es uniforme, durante picos podemos llegar a 150 consultas diarias. Descubrimos Vambe gracias a un articulo en linea sobre automatizacion de procesos. La capacidad de proporcionar actualizaciones en tiempo real y gestionar incidencias de manera automatizada es algo que consideramos fundamental para mejorar la satisfaccion de nuestros clientes."
Fernando Torres,f.torres@example.com,56978901234,2024-06-05,Zorro,0,"Nuestra agencia de viajes ha experimentado un aumento significativo en las solicitudes de informacion sobre destinos y cambios de itinerarios. Con la temporada alta a la vuelta de la esquina, manejamos cerca de 200 interacciones semanales. Asisti a un webinar donde presentaron Vambe y me parecio una solucion interesante. Estamos buscando una herramienta que no solo automatice las respuestas, sino que tambien pueda ofrecer recomendaciones personalizadas basadas en las preferencias del cliente."
Claudia Vega,c.vega@example.com,56989012345,2024-06-10,Tiburón,0,"Dirijo una marca de moda sostenible y desde el lanzamiento de nuestra ultima coleccion, las consultas sobre nuestros productos han aumentado. Un amigo en la industria recomendo Vambe como una herramienta eficaz para gestionar la atencion al cliente sin perder el toque personal. Queremos asegurarnos de que nuestras respuestas reflejen los valores de sostenibilidad y etica que promueve nuestra marca, mientras mejoramos la eficiencia en la gestion de consultas."
Roberto Silva,r.silva@example.com,56990123456,2024-06-15,Toro,1,"Nuestra firma de consultoria trabaja con multiples clientes internacionales, lo que genera una gran cantidad de interacciones diarias. Conocimos Vambe en una feria empresarial y nos intereso la posibilidad de optimizar nuestras comunicaciones mediante su tecnologia. Necesitamos una solucion que pueda adaptarse a distintos idiomas y zonas horarias, permitiendonos mantener un nivel de servicio consistente a nivel global."
Isabel Fuentes,i.fuentes@example.com,56901234567,2024-06-20,Boa,1,"Como restaurante, la gestion de reservas y pedidos en linea se ha vuelto complicada durante los fines de semana. Encontramos Vambe mientras buscabamos soluciones en Google y creemos que podria ayudarnos a manejar mejor estas interacciones, que pueden superar los 100 mensajes diarios. Ademas, nos interesa la posibilidad de integrar la solucion con nuestras plataformas de reservas actuales para optimizar el flujo de trabajo."
Javier Morales,j.morales@example.com,56911223344,2024-07-01,Boa,1,"Nuestra empresa de software ha estado creciendo rapidamente, y con ello, la cantidad de consultas de soporte tecnico que recibimos a diario. Aunque intentamos manejarlo internamente, el volumen ya supera los 250 mensajes diarios, lo cual es complicado para nuestro pequeño equipo. Conoci Vambe gracias a una publicacion en LinkedIn y me parecio una opcion interesante para automatizar estas interacciones sin comprometer la calidad del servicio. Valoramos especialmente la capacidad de Vambe para integrarse con nuestros sistemas de tickets existentes."
Camila Herrera,c.herrera@example.com,56922334455,2024-07-05,Zorro,1,"Somos una pequeña empresa de catering que ha visto un aumento significativo en las solicitudes de eventos corporativos. Antes, podiamos manejar las consultas manualmente, pero ahora con mas de 100 mensajes diarios, necesitamos una solucion automatizada. Me entere de Vambe a traves de una recomendacion de un colega en la industria de eventos. Nos interesa mantener un tono personalizado en las respuestas, ya que cada cliente tiene necesidades especificas para sus eventos."
Diego Alvarez,d.alvarez@example.com,56933445566,2024-07-10,Zorro,1,"Dirijo una tienda de electronicos y desde que lanzamos nuestra tienda en linea, hemos tenido problemas para gestionar las preguntas sobre productos y envios. La cantidad de consultas varia, pero durante las promociones puede superar los 300 mensajes diarios. Asisti a un seminario donde mencionaron Vambe y me intereso explorar como podria ayudarnos a manejar este volumen. Necesitamos una solucion que pueda escalar facilmente durante las promociones sin afectar el rendimiento."
Valentina Soto,v.soto@example.com,56944556677,2024-07-15,Puma,1,"Nuestra empresa de bienes raices esta buscando una forma de mejorar la comunicacion con los clientes potenciales que consultan por propiedades. Las consultas suelen ser sobre disponibilidad y detalles de propiedades, y actualmente manejamos unas 200 interacciones semanales. Conoci Vambe en una feria de tecnologia inmobiliaria y creo que podria ser la solucion que necesitamos. Nos interesa especialmente la capacidad de integrar la herramienta con nuestra base de datos de propiedades."
Matias Fernandez,m.fernandez@example.com,56955667788,2024-07-20,Boa,1,"Trabajo en una ONG que recibe muchas consultas sobre nuestros programas y eventos. Aunque no tenemos un volumen constante de mensajes, durante las campañas especificas podemos llegar a recibir mas de 150 consultas al dia. Un voluntario nos hablo de Vambe y creemos que podria ayudarnos a gestionar mejor estas interacciones sin perder el contacto humano. La flexibilidad de Vambe para adaptarse a diferentes tipos de consultas es algo que valoramos."
Sofia Castillo,s.castillo@example.com,56966778899,2024-07-25,Boa,0,"Nuestra empresa de seguridad privada ha estado recibiendo muchas solicitudes de informacion sobre nuestros servicios. La gestion manual de estas consultas se ha vuelto ineficiente, especialmente porque manejamos alrededor de 100 interacciones diarias. Escuche sobre Vambe en un podcast de tecnologia y me intereso la posibilidad de automatizar estas tareas. Necesitamos una solucion que pueda manejar consultas urgentes y programar servicios automaticamente."
Andres Vargas,a.vargas@example.com,56977889900,2024-07-30,Puma,0,"Somos una empresa de turismo aventura y desde que comenzamos a operar en nuevas regiones, hemos visto un incremento en las consultas sobre tours y disponibilidad. Durante la temporada alta, manejamos mas de 250 mensajes semanales. Conoci Vambe gracias a un amigo que trabaja en el sector turistico y me recomendo su plataforma. Nos interesa especialmente la capacidad de Vambe para ofrecer respuestas personalizadas segun el tipo de tour y la ubicacion."
Daniela Rojas,d.rojas@example.com,56988990011,2024-08-01,Zorro,1,Dirijo una consultora de recursos humanos y gestionamos muchas consultas sobre nuestros servicios de capacitacion y reclutamiento. El volumen de interacciones ha crecido en los ultimos meses y ya supera los 200 mensajes por semana. Descubrimos Vambe a traves de un articulo sobre innovacion en la gestion empresarial y queremos explorar su aplicacion en nuestro negocio. Nos interesa una solucion que pueda clasificar automaticamente las consultas y asignarlas al equipo correspondiente.
Felipe Navarro,f.navarro@example.com,56999001122,2024-08-05,Tiburón,1,"Nuestra tienda de productos organicos ha visto un crecimiento en las ventas online, lo que ha generado un aumento en las consultas sobre disponibilidad y envios. Durante las promociones, podemos llegar a recibir mas de 150 mensajes al dia. Escuche sobre Vambe en una charla sobre comercio electronico y me intereso la idea de automatizar la atencion al cliente. Valoramos la posibilidad de ofrecer respuestas rapidas y precisas sin perder la cercania con nuestros clientes."
Laura Gutierrez,l.gutierrez@example.com,56910111213,2024-08-10,Toro,1,"Nuestra empresa de servicios legales ha experimentado un aumento en las consultas sobre nuestros servicios, especialmente en asesorias para pequeñas empresas. Actualmente, manejamos alrededor de 80 interacciones diarias, lo que es dificil de sostener para nuestro equipo. Conoci Vambe en una conferencia de tecnologia legal y creemos que podria ser la herramienta adecuada para optimizar nuestro proceso de atencion. Nos interesa una solucion que pueda manejar consultas complejas y redirigirlas al abogado adecuado."
Martín Espinoza,m.espinoza@example.com,56911235813,2024-10-22,Puma,1,"Nuestra empresa de asesoría financiera ha enfrentado un incremento en las consultas de clientes interesados en inversiones internacionales. Desde que expandimos nuestro portafolio de servicios, las preguntas sobre regulaciones y oportunidades en distintos países han aumentado considerablemente. Normalmente manejamos alrededor de 150 interacciones semanales, pero en temporadas de alta demanda esto puede duplicarse. Conocí Vambe en un seminario de fintech y me llamó la atención su capacidad para automatizar respuestas complejas sin comprometer la precisión, algo crucial en nuestro sector."
Isidora Palma,i.palma@example.com,56922334477,2024-10-24,Puma,0,"Dirijo una tienda de productos artesanales en línea y desde que lanzamos nuestra última colección, hemos visto un aumento significativo en las consultas sobre materiales y procesos de fabricación. Las preguntas suelen ser muy específicas, y nuestro equipo pequeño no siempre puede responder de inmediato. Descubrimos Vambe a través de una recomendación en un grupo de emprendedores y nos interesa su capacidad de personalizar las respuestas manteniendo el tono cercano y auténtico que caracteriza a nuestra marca."
Leonardo Cabrera,l.cabrera@example.com,56933445588,2024-10-26,Puma,0,"Nuestra empresa de tecnología ha estado recibiendo un volumen creciente de consultas sobre soporte técnico y actualizaciones de software. Aunque contamos con un equipo dedicado, el crecimiento exponencial de usuarios ha hecho que las respuestas manuales sean insuficientes. Conocí Vambe en una conferencia sobre automatización y me impresionó su integración con sistemas de tickets y su capacidad para ofrecer respuestas en tiempo real, lo cual podría mejorar considerablemente nuestra eficiencia operativa."
Gabriela Soto,g.soto@example.com,56944556699,2024-10-28,Toro,1,"En nuestra empresa de eventos corporativos, la organización de conferencias y seminarios ha generado un aumento en las consultas logísticas. Desde preguntas sobre disponibilidad de espacios hasta detalles técnicos sobre equipos de sonido, nuestro equipo de atención al cliente ha tenido dificultades para mantenerse al día. Escuché sobre Vambe en un podcast de tecnología y eventos, y me interesó su capacidad para gestionar múltiples tipos de consultas, permitiéndonos enfocarnos en la planificación estratégica de los eventos."
Cristian Figueroa,c.figueroa@example.com,56955667700,2024-10-30,Puma,1,"Somos una startup de educación online que ofrece cursos personalizados. Con el crecimiento de nuestra plataforma, las consultas sobre inscripciones, pagos y contenido han aumentado de manera considerable. Un colega recomendó Vambe como una solución efectiva para automatizar las respuestas sin perder el toque humano que caracteriza nuestra atención. Nos interesa especialmente la posibilidad de integrar la herramienta con nuestra base de datos de estudiantes para ofrecer respuestas personalizadas."
Antonia Reyes,a.reyes@example.com,56966778811,2024-11-01,Tiburón,1,"Dirijo una empresa de consultoría ambiental y, en los últimos meses, hemos recibido un incremento en las solicitudes de información sobre nuestros servicios de evaluación de impacto ambiental. Cada cliente tiene necesidades específicas, lo que complica la automatización. Sin embargo, escuché sobre Vambe en una conferencia sobre sostenibilidad y tecnología, y su capacidad de adaptarse a diferentes contextos empresariales nos llamó la atención. Buscamos una herramienta que no solo automatice respuestas, sino que también permita segmentar las consultas por tipo de proyecto."
Felipe Castro,f.castro@example.com,56977889922,2024-11-03,Boa,1,"Nuestra empresa de transporte internacional ha enfrentado desafíos en la gestión de consultas sobre envíos y logística aduanera. Durante picos de demanda, manejamos más de 300 interacciones diarias, lo que ha saturado a nuestro equipo de soporte. Descubrí Vambe en un foro de logística y me interesó su capacidad para automatizar la comunicación sin comprometer la precisión, especialmente en temas sensibles como la documentación de exportación e importación."
Camila Espinosa,c.espinosa@example.com,56988990033,2024-11-05,Puma,0,"Nuestra clínica odontológica ha experimentado un aumento en las consultas sobre tratamientos y disponibilidad de citas. Con la reciente apertura de una nueva sucursal, el volumen de interacciones se ha duplicado. Conocí Vambe a través de un colega en el sector de salud y me llamó la atención su enfoque en la automatización respetando la confidencialidad de la información de los pacientes. Nos interesa una solución que pueda integrarse con nuestro sistema de citas y gestionar preguntas frecuentes de manera eficiente."
Jorge Morales,j.morales2@example.com,56999001144,2024-11-07,Tiburón,0,Nuestra tienda de instrumentos musicales ha visto un incremento en las consultas desde que lanzamos nuestra plataforma de ventas en línea. Las preguntas varían desde especificaciones técnicas hasta disponibilidad de productos. Asistí a un taller sobre comercio electrónico donde se mencionó Vambe y me interesó su capacidad de personalizar respuestas para mantener la cercanía con nuestros clientes músicos. Necesitamos una solución que pueda adaptarse a las variaciones en el volumen de consultas durante las temporadas de promociones.
Fernanda Loyola,f.loyola@example.com,56910111255,2024-11-09,Toro,1,"En nuestra empresa de servicios de traducción profesional, hemos recibido un aumento en las solicitudes de cotización y consultas sobre disponibilidad de idiomas. Cada proyecto tiene requisitos específicos y la gestión manual de estas interacciones se ha vuelto ineficiente. Descubrimos Vambe en una conferencia de tecnología aplicada a la lingüística y creemos que su capacidad para clasificar y gestionar consultas podría optimizar nuestra atención al cliente sin perder el enfoque personalizado que ofrecemos."
Ricardo Pino,r.pino@example.com,56921222366,2024-11-11,Zorro,0,"Nuestra empresa de diseño de interiores ha crecido rápidamente, lo que ha generado un aumento en las consultas sobre servicios y presupuestos. El volumen de interacciones se duplica durante temporadas de lanzamientos o ferias. Escuché sobre Vambe en un evento de tecnología para el hogar y me llamó la atención su capacidad para ofrecer respuestas automáticas personalizadas, algo que podría ayudarnos a mejorar la eficiencia sin perder el toque creativo que caracteriza a nuestra empresa."
Sofía Alarcón,s.alarcon@example.com,56932333477,2024-11-13,Boa,1,"Nuestra empresa de producción audiovisual ha visto un incremento en las consultas sobre servicios de grabación y edición. Cada cliente tiene necesidades técnicas específicas, lo que ha complicado la gestión de las interacciones. Un colega en la industria recomendó Vambe y nos interesa su capacidad para ofrecer respuestas personalizadas y gestionar consultas técnicas de manera eficiente, especialmente durante la planificación de proyectos grandes."
Tomás Villarroel,t.villarroel@example.com,56943444588,2024-11-15,Boa,0,"Somos una empresa de asesoría contable y legal, y en los últimos meses hemos visto un aumento en las consultas sobre cambios en regulaciones tributarias. Con la expansión de nuestros servicios a nuevos mercados, el volumen de interacciones ha crecido significativamente. Descubrimos Vambe en una charla sobre tecnología aplicada a la contabilidad y creemos que su capacidad para automatizar respuestas complejas podría ayudarnos a mejorar la atención al cliente y liberar tiempo para nuestro equipo."
Daniela Gutierrez,d.gutierrez@example.com,56954555699,2024-11-17,Tiburón,1,"Nuestra tienda de productos de belleza natural ha visto un crecimiento en las ventas en línea, lo que ha generado un aumento en las consultas sobre ingredientes y envíos. Durante las promociones, el volumen de mensajes puede superar los 200 diarios. Conocimos Vambe en un foro de comercio electrónico y nos llamó la atención su capacidad para automatizar respuestas sin perder la cercanía con nuestros clientes. Valoramos especialmente su integración con plataformas de e-commerce."
Lucas Santander,l.santander@example.com,56965666700,2024-11-19,Zorro,0,"Dirijo una agencia de turismo cultural y, con la reapertura de fronteras, hemos visto un aumento significativo en las consultas sobre tours y disponibilidad. El volumen de interacciones se triplica durante temporadas altas. Escuché sobre Vambe en una conferencia de tecnología aplicada al turismo y me interesó su capacidad de gestionar consultas personalizadas según el tipo de tour y la región, lo que podría mejorar nuestra eficiencia operativa."
Valeria Peña,v.pena@example.com,56976777811,2024-11-21,Toro,1,"Nuestra empresa de consultoría tecnológica recibe numerosas consultas sobre implementación de software y ciberseguridad. Con el crecimiento de nuestra cartera de clientes, la gestión manual de estas interacciones se ha vuelto insostenible. Descubrimos Vambe en una feria tecnológica y creemos que su plataforma podría ayudarnos a optimizar la atención al cliente, permitiéndonos enfocarnos en proyectos más complejos sin comprometer la calidad del servicio."
Diego Carrasco,d.carrasco@example.com,56987888922,2024-11-23,Puma,0,"Somos una empresa de desarrollo de videojuegos y, desde el lanzamiento de nuestro último título, las consultas sobre soporte técnico y actualizaciones han aumentado exponencialmente. Un colega en la industria recomendó Vambe y creemos que su capacidad de integrarse con nuestros sistemas de soporte podría ayudarnos a gestionar el volumen de interacciones sin afectar la experiencia del usuario."
